{
  "$schema": "https://spec.modulora.dev/schemas/v0/taxonomy.schema.json",
  "taxonomyVersion": "0.1.0",
  "description": "Canonical category and component-type vocabulary. Category answers what a thing is for; componentType answers what it is. Aliases migrate renamed values without breaking existing releases; deprecated values remain valid for existing releases but are rejected for new publishes.",
  "categories": [
    {
      "id": "layout",
      "label": "Layout"
    },
    {
      "id": "navigation",
      "label": "Navigation"
    },
    {
      "id": "forms",
      "label": "Forms & Inputs"
    },
    {
      "id": "data-display",
      "label": "Data Display"
    },
    {
      "id": "date-time",
      "label": "Date & Time"
    },
    {
      "id": "feedback",
      "label": "Feedback & Overlays"
    },
    {
      "id": "media",
      "label": "Media"
    },
    {
      "id": "commerce",
      "label": "Commerce"
    },
    {
      "id": "marketing",
      "label": "Marketing"
    },
    {
      "id": "charts",
      "label": "Charts"
    },
    {
      "id": "ai",
      "label": "AI & Chat"
    },
    {
      "id": "utilities",
      "label": "Utilities"
    }
  ],
  "componentTypes": [
    {
      "id": "accordion",
      "label": "Accordion"
    },
    {
      "id": "alert",
      "label": "Alert"
    },
    {
      "id": "alert-dialog",
      "label": "Alert Dialog"
    },
    {
      "id": "aspect-ratio",
      "label": "Aspect Ratio"
    },
    {
      "id": "attachment",
      "label": "Attachment"
    },
    {
      "id": "avatar",
      "label": "Avatar"
    },
    {
      "id": "badge",
      "label": "Badge"
    },
    {
      "id": "breadcrumb",
      "label": "Breadcrumb"
    },
    {
      "id": "bubble",
      "label": "Bubble"
    },
    {
      "id": "button",
      "label": "Button"
    },
    {
      "id": "button-group",
      "label": "Button Group"
    },
    {
      "id": "calendar",
      "label": "Calendar"
    },
    {
      "id": "card",
      "label": "Card"
    },
    {
      "id": "carousel",
      "label": "Carousel"
    },
    {
      "id": "chart",
      "label": "Chart"
    },
    {
      "id": "checkbox",
      "label": "Checkbox"
    },
    {
      "id": "collapsible",
      "label": "Collapsible"
    },
    {
      "id": "combobox",
      "label": "Combobox"
    },
    {
      "id": "command",
      "label": "Command"
    },
    {
      "id": "context-menu",
      "label": "Context Menu"
    },
    {
      "id": "data-table",
      "label": "Data Table"
    },
    {
      "id": "date-picker",
      "label": "Date Picker"
    },
    {
      "id": "dialog",
      "label": "Dialog"
    },
    {
      "id": "direction",
      "label": "Direction"
    },
    {
      "id": "drawer",
      "label": "Drawer"
    },
    {
      "id": "dropdown-menu",
      "label": "Dropdown Menu"
    },
    {
      "id": "empty",
      "label": "Empty"
    },
    {
      "id": "field",
      "label": "Field"
    },
    {
      "id": "hover-card",
      "label": "Hover Card"
    },
    {
      "id": "input",
      "label": "Input"
    },
    {
      "id": "input-group",
      "label": "Input Group"
    },
    {
      "id": "input-otp",
      "label": "Input OTP"
    },
    {
      "id": "item",
      "label": "Item"
    },
    {
      "id": "kbd",
      "label": "Kbd"
    },
    {
      "id": "label",
      "label": "Label"
    },
    {
      "id": "marker",
      "label": "Marker"
    },
    {
      "id": "menubar",
      "label": "Menubar"
    },
    {
      "id": "message",
      "label": "Message"
    },
    {
      "id": "message-scroller",
      "label": "Message Scroller"
    },
    {
      "id": "native-select",
      "label": "Native Select"
    },
    {
      "id": "navigation-menu",
      "label": "Navigation Menu"
    },
    {
      "id": "pagination",
      "label": "Pagination"
    },
    {
      "id": "popover",
      "label": "Popover"
    },
    {
      "id": "progress",
      "label": "Progress"
    },
    {
      "id": "radio-group",
      "label": "Radio Group"
    },
    {
      "id": "resizable",
      "label": "Resizable"
    },
    {
      "id": "scroll-area",
      "label": "Scroll Area"
    },
    {
      "id": "select",
      "label": "Select"
    },
    {
      "id": "separator",
      "label": "Separator"
    },
    {
      "id": "sheet",
      "label": "Sheet"
    },
    {
      "id": "sidebar",
      "label": "Sidebar"
    },
    {
      "id": "skeleton",
      "label": "Skeleton"
    },
    {
      "id": "slider",
      "label": "Slider"
    },
    {
      "id": "sonner",
      "label": "Sonner"
    },
    {
      "id": "spinner",
      "label": "Spinner"
    },
    {
      "id": "switch",
      "label": "Switch"
    },
    {
      "id": "table",
      "label": "Table"
    },
    {
      "id": "tabs",
      "label": "Tabs"
    },
    {
      "id": "textarea",
      "label": "Textarea"
    },
    {
      "id": "toast",
      "label": "Toast"
    },
    {
      "id": "toggle",
      "label": "Toggle"
    },
    {
      "id": "toggle-group",
      "label": "Toggle Group"
    },
    {
      "id": "tooltip",
      "label": "Tooltip"
    },
    {
      "id": "typography",
      "label": "Typography"
    },
    {
      "id": "other",
      "label": "Other"
    }
  ],
  "aliases": {
    "forms-inputs": "forms"
  },
  "deprecated": []
}